{
  "$ref": "#/definitions/scenario",
  "definitions": {
    "scenario": {
      "type": "object",
      "properties": {
        "id": {
          "type": "string",
          "minLength": 1
        },
        "name": {
          "type": "string",
          "minLength": 1
        },
        "narrative_md": {
          "type": "string",
          "minLength": 1
        },
        "capability_profile": {
          "type": "array",
          "items": {
            "type": "object",
            "properties": {
              "capability_id": {
                "type": "string",
                "enum": [
                  "C1",
                  "C2",
                  "C3",
                  "C4",
                  "C5",
                  "C6",
                  "C7",
                  "C8",
                  "C9",
                  "C10",
                  "C11",
                  "C12"
                ]
              },
              "intensity": {
                "type": "integer",
                "minimum": 0,
                "maximum": 4
              },
              "note": {
                "type": "string",
                "minLength": 1
              }
            },
            "required": [
              "capability_id",
              "intensity",
              "note"
            ],
            "additionalProperties": false
          },
          "minItems": 1
        },
        "fixture": {
          "type": "boolean"
        }
      },
      "required": [
        "id",
        "name",
        "narrative_md",
        "capability_profile"
      ],
      "additionalProperties": false
    }
  },
  "$schema": "http://json-schema.org/draft-07/schema#",
  "$id": "atlas/scenario",
  "$comment": "GENERATED from src/lib/schemas (Zod is normative — ENG §8/MN-15). Do not edit by hand."
}
